{
  "schema_version": 1,
  "game_version": "sample",
  "exported_at_utc": "2026-09-11T12:00:00Z",
  "products": [
    {
      "id": "iron_ore",
      "name": "Iron Ore",
      "state": "solid",
      "is_storable": true,
      "is_trash": false,
      "radioactivity": 0
    },
    {
      "id": "steel",
      "name": "Steel",
      "state": "solid",
      "is_storable": true,
      "is_trash": false,
      "radioactivity": 0
    }
  ],
  "recipes": [
    {
      "id": "steel_recipe",
      "name": "Steel",
      "duration_seconds": 30,
      "inputs": [
        {
          "product_id": "iron_ore",
          "product_name": "Iron Ore",
          "amount": 2
        }
      ],
      "outputs": [
        {
          "product_id": "steel",
          "product_name": "Steel",
          "amount": 1
        }
      ]
    }
  ],
  "buildings": [
    {
      "id": "blast_furnace",
      "name": "Blast Furnace",
      "category_id": "smelting",
      "category_name": "Smelting",
      "is_farm": false,
      "is_storage": false,
      "is_mine": false,
      "workers": 5,
      "maintenance_product_id": "maintenance_2",
      "maintenance_per_month": 4,
      "electricity_consumed": 120,
      "electricity_generated": 0,
      "storage_capacity": 0,
      "transfer_speed_per_minute": 0,
      "research_speed": 0,
      "build_costs": [],
      "recipe_ids": ["steel_recipe"]
    }
  ]
}
